{
  "schema_version": "1.1",
  "doc_type": "weekly_digest",
  "date": "2026-04-05",
  "week_label": "2026-W14",
  "meta": {
    "generated_at": "2026-04-07T20:10:51Z",
    "date_range": {
      "start": "2026-04-05",
      "end": "2026-04-05"
    },
    "sources": {
      "baseline_date": "2026-04-05",
      "delta_dates": []
    },
    "tags": [
      "migrated_from_md"
    ]
  },
  "body": {
    "executive_summary": "This is the inaugural weekly baseline for digiquant-atlas. The system launched during peak geopolitical stress — the Iran War is driving oil to ~$112/bbl, gold corrected from ATH $5,265 to ~$4,400, and equities are range-bound with SPY at $655.83. The macro regime is Geopolitical Shock transitioning to Inflationary, with higher-for-longer rates now locked in as oil-driven CPI keeps the Fed on hold at 4.75-5.00%.\n\n---",
    "daily_bias_shifts": [
      {
        "label": "Sun",
        "date": "2026-04-05",
        "macro": "See full_document_markdown",
        "equities": "—",
        "crypto": "—",
        "bonds": "—",
        "key_catalyst": "Baseline week"
      }
    ],
    "regime_summary": {
      "growth": {
        "baseline": "See markdown",
        "friday": "—",
        "weekly_shift": "TBD"
      },
      "inflation": {
        "baseline": "See markdown",
        "friday": "—",
        "weekly_shift": "TBD"
      },
      "policy": {
        "baseline": "See markdown",
        "friday": "—",
        "weekly_shift": "TBD"
      },
      "risk_appetite": {
        "baseline": "See markdown",
        "friday": "—",
        "weekly_shift": "TBD"
      },
      "net_change": "See full_document_markdown for detail."
    },
    "asset_class_summary": {
      "equities": {
        "weekly_bias": "See markdown",
        "highlights": "—"
      },
      "crypto": {
        "weekly_bias": "See markdown",
        "highlights": "—"
      },
      "bonds": {
        "weekly_bias": "See markdown",
        "highlights": "—"
      },
      "commodities": {
        "weekly_bias": "See markdown",
        "highlights": "—"
      },
      "forex": {
        "weekly_bias": "See markdown",
        "highlights": "—"
      }
    },
    "thesis_review": [
      {
        "thesis_id": "migrated",
        "thesis": "Migrated from markdown; see full_document_markdown",
        "weekly_evidence": "—",
        "status_change": "unchanged"
      }
    ],
    "next_week_setup": {
      "key_events": [
        {
          "day": "—",
          "date": "2026-04-05",
          "event": "See full_document_markdown",
          "why_it_matters": "Legacy migration"
        }
      ],
      "heading_in_bias": "See full_document_markdown",
      "primary_watch": "See full_document_markdown",
      "positions_to_review": []
    },
    "key_takeaway": "The Iran War has created a rare regime where both energy and cash are the correct trades simultaneously. The Hormuz Protocol is the fulcrum — if it holds, the oil premium compresses and the energy trade gets crowded; if it fails, we're in a new era of energy scarcity. The portfolio is positioned for the most likely outcome (managed tension with sustained premium) while maintaining 50% cash as insurance against tail scenarios.",
    "full_document_markdown": "# Weekly digiquant-atlas Digest — 2026-W14\n\n> Week 14 of 2026 | Generated: 2026-04-05\n> Synthesized from: 2026-04-05 (Sunday Baseline)\n> Source files: 1 weekly baseline + 0 delta days (first run)\n\n---\n\n## Week in Review — Executive Summary\n\nThis is the inaugural weekly baseline for digiquant-atlas. The system launched during peak geopolitical stress — the Iran War is driving oil to ~$112/bbl, gold corrected from ATH $5,265 to ~$4,400, and equities are range-bound with SPY at $655.83. The macro regime is Geopolitical Shock transitioning to Inflationary, with higher-for-longer rates now locked in as oil-driven CPI keeps the Fed on hold at 4.75-5.00%.\n\n---\n\n## Week Evolution — Daily Bias Shifts\n\n| Day | Date | Macro | Equities | Crypto | Bonds | Key Catalyst |\n|-----|------|-------|----------|--------|-------|-------------|\n| Sun (Baseline) | Apr 5 | Geopolitical Shock → Inflationary | Neutral/Conflicted | Neutral/Conflicted | Bullish Short / Bearish Long | Hormuz Protocol + continued Iran strikes |\n| Mon | Apr 6 | — | — | — | — | Market closed (pending) |\n| Tue | Apr 7 | — | — | — | — | — |\n| Wed | Apr 8 | — | — | — | — | — |\n| Thu | Apr 9 | — | — | — | — | — |\n| Fri | Apr 10 | — | — | — | — | CPI Report (3.5% consensus) |\n\n**Net week shift**: Baseline established. Week ahead hinges on CPI April 10 and bank earnings April 11.\n**Regime held / broken**: To be determined through the week.\n\n---\n\n## Weekly Regime Summary\n\n| Factor | Baseline (Sun) | Friday Close | Weekly Shift |\n|--------|---------------|-------------|--------------|\n| Growth | Slowing (ISM 48.5) | — | TBD |\n| Inflation | Hot (CPI ~3.8%, WTI $112) | — | TBD (CPI Apr 10) |\n| Policy | On Hold (4.75-5.00%) | — | TBD |\n| Risk Appetite | Risk-Off / Mixed | — | TBD |\n\n---\n\n## Equities — Weekly\n\n**Weekly Bias**: Neutral / Conflicted\n\n**Index Performance (Baseline Snapshot)**:\n| Index | Baseline | Key Level |\n|-------|----------|-----------|\n| SPY | $655.83 (+0.09%) | Support $640, Resistance $665 |\n| QQQ | $584.98 (+0.11%) | Below 50-DMA |\n| IWM | $251.29 (+0.69%) | Small caps improving |\n\n**Sector Rotation Summary**:\n- **Leaders**: XLK (+0.80%), XLP (+0.53%), XLU (+0.50%), XLE (+0.47%)\n- **Laggards**: XLV (-0.62%), XLY (~-0.80%), XLI (-0.40%)\n- **Implied cycle signal**: Mixed — both risk-on and defensive leading simultaneously\n\n---\n\n## Crypto — Weekly\n\n**Weekly Bias**: Neutral / Conflicted\n\n| Asset | Baseline | Key Level |\n|-------|----------|-----------|\n| BTC | $69,183 (+0.29%) | $65K support, $72K resistance |\n| IBIT | $37.97 (-1.73%) | ETF outflows -$500M weekly |\n\n**Narrative**: BTC failed safe-haven test. Not acting as digital gold in Iran crisis. 0% allocation validated.\n\n---\n\n## Bonds & Rates — Weekly\n\n**Weekly Bias**: Bullish short duration / Bearish long duration\n\n| Yield | Baseline | Signal |\n|-------|----------|--------|\n| 2Y | 4.45% | Fed anchored |\n| 10Y | 4.35% | Flight-to-quality bid |\n| 30Y | 4.55% | Long end most sensitive |\n| 2s10s | -10bps | Inverted, flattening |\n\n**Fed Watch**: 4.75-5.00% on hold. Cut probability ~35% (declining). Oil inflation delays cuts.\n**Credit**: HY spreads +15bps month — early stress.\n\n---\n\n## Commodities — Weekly\n\n- **WTI**: ~$112/bbl — War premium $20-25. CTA longs at 90th percentile (CROWDING).\n- **Gold**: IAU $87.94 (-1.94%) — Correcting from ATH $5,265. Thesis intact above $4,200.\n- **Oil ETFs**: USO +11.15% (Friday), DBO +2.05%, DBC +2.27%\n\n---\n\n## Forex — Weekly\n\n**DXY**: ~103.5 (+0.3%) — Mild safe-haven bid\n**Key pairs**: EUR/USD 1.080 (weak), USD/JPY 152 (BOJ watch), USD/CAD 1.360 (petrocurrency)\n**EM FX**: TRY, ZAR stressed. MXN stable.\n\n---\n\n## Thesis Tracker — Weekly Review\n\n| ID | Thesis | Weekly Evidence | Status |\n|----|--------|----------------|--------|\n| T-001 | Iran War / Energy + Gold | WTI $112 (war premium confirmed), IAU correcting but >$4,200 | Confirmed |\n| T-002 | Higher-for-Longer Rates | Fed boxed by oil inflation. BIL/SHY yielding ~4.75% | Confirmed (max conviction) |\n| T-003 | Defensive Rotation | XLP +0.53% outperforming. XLV exited (drug pricing risk) | Monitoring |\n\n**New Theses Pipeline**: T-004 (ITA/Defense spending) and T-005 (GDX/Gold miners) flagged but not activated — no new positions without formal thesis.\n\n---\n\n## Next Week Setup (W15)\n\n**Key Events**:\n| Day | Date | Event | Why It Matters |\n|-----|------|-------|---------------|\n| Mon | Apr 6 | Market Open | Execute rebalance: EXIT XLV, ADD XLE +3% |\n| Thu | Apr 10 | CPI Report | 3.5% consensus. Hot = stagflation fear. Cool = regime shift. |\n| Fri | Apr 11 | Bank Earnings (JPM, WFC, C) | Credit cycle health check. HY spreads rising. |\n| All week | — | Hormuz Protocol updates | De-escalation pathway. Oil premium compression if holds. |\n| All week | — | Fed speakers | Any shift in higher-for-longer messaging |\n\n**Heading into next week with**:\n- **Bias**: Defensive / Risk-Off\n- **Primary Watch**: CPI April 10 — the single most important catalyst. Determines if inflation regime accelerates or stabilizes.\n- **Positions to review**: XLE (crowding risk if WTI >$118), IAU (thesis hold if >$4,200), XLV exit execution\n\n---\n\n## Week's Key Takeaway\n\nThe Iran War has created a rare regime where both energy and cash are the correct trades simultaneously. The Hormuz Protocol is the fulcrum — if it holds, the oil premium compresses and the energy trade gets crowded; if it fails, we're in a new era of energy scarcity. The portfolio is positioned for the most likely outcome (managed tension with sustained premium) while maintaining 50% cash as insurance against tail scenarios.\n\n---\n\n*Daily digests: 2026-04-05 (baseline)*\n"
  }
}
